{"aggregate_payload_sha256":"e14bbb06327a07c2605a8a78c7c9db2d9c060c1cd3a7c225152c8c04be48e6aa","cohort_id":"mnq-202609-5m-v1","contract_policy":{"candidate_date_end":"2026-07-24","candidate_date_start":"2026-06-22","contract_label":"MNQ SEP26","expiry_month":9,"expiry_year":2026,"full_name":"MNQ SEP26"},"exclusion_ledger":{"bundle_path":"exclusions.json","path":"exclusions.json","producing_checkpoint":"e9ddb486ffb5ab7f9fc72baf6a81900f90eeb21f","schema_version":"2.0","sha256":"655bb649b79ce0c02fee988f8c98470e9a7d294021a62c3134252369f38cb73e"},"producing_checkpoint":"cd6e3154e852bdcda632cf054e9f921f615f21c4","schema_version":"2.0","selection_algorithm":{"id":"CHRONOLOGICAL_TEN_STRATA_EARLIEST","stratum_count":10,"version":"1.0"},"selection_count":10,"selection_influence":{"hierarchy_output_used":false,"oracle_output_used":false,"project_output_used":false},"selections":[{"case_id":"mnq-202609-5m-td2026-06-22-w01","selected_eligible_index":0,"stratum_end_index":1,"stratum_number":1,"stratum_start_index":0,"trading_date":"2026-06-22","window_policy":"FIRST_250_NATIVE_5M_SESSION_BARS"},{"case_id":"mnq-202609-5m-td2026-06-24-w02","selected_eligible_index":2,"stratum_end_index":3,"stratum_number":2,"stratum_start_index":2,"trading_date":"2026-06-24","window_policy":"FIRST_250_NATIVE_5M_SESSION_BARS"},{"case_id":"mnq-202609-5m-td2026-06-26-w03","selected_eligible_index":4,"stratum_end_index":6,"stratum_number":3,"stratum_start_index":4,"trading_date":"2026-06-26","window_policy":"FIRST_250_NATIVE_5M_SESSION_BARS"},{"case_id":"mnq-202609-5m-td2026-07-01-w04","selected_eligible_index":7,"stratum_end_index":8,"stratum_number":4,"stratum_start_index":7,"trading_date":"2026-07-01","window_policy":"FIRST_250_NATIVE_5M_SESSION_BARS"},{"case_id":"mnq-202609-5m-td2026-07-06-w05","selected_eligible_index":9,"stratum_end_index":11,"stratum_number":5,"stratum_start_index":9,"trading_date":"2026-07-06","window_policy":"FIRST_250_NATIVE_5M_SESSION_BARS"},{"case_id":"mnq-202609-5m-td2026-07-09-w06","selected_eligible_index":12,"stratum_end_index":13,"stratum_number":6,"stratum_start_index":12,"trading_date":"2026-07-09","window_policy":"FIRST_250_NATIVE_5M_SESSION_BARS"},{"case_id":"mnq-202609-5m-td2026-07-13-w07","selected_eligible_index":14,"stratum_end_index":15,"stratum_number":7,"stratum_start_index":14,"trading_date":"2026-07-13","window_policy":"FIRST_250_NATIVE_5M_SESSION_BARS"},{"case_id":"mnq-202609-5m-td2026-07-15-w08","selected_eligible_index":16,"stratum_end_index":18,"stratum_number":8,"stratum_start_index":16,"trading_date":"2026-07-15","window_policy":"FIRST_250_NATIVE_5M_SESSION_BARS"},{"case_id":"mnq-202609-5m-td2026-07-20-w09","selected_eligible_index":19,"stratum_end_index":20,"stratum_number":9,"stratum_start_index":19,"trading_date":"2026-07-20","window_policy":"FIRST_250_NATIVE_5M_SESSION_BARS"},{"case_id":"mnq-202609-5m-td2026-07-22-w10","selected_eligible_index":21,"stratum_end_index":23,"stratum_number":10,"stratum_start_index":21,"trading_date":"2026-07-22","window_policy":"FIRST_250_NATIVE_5M_SESSION_BARS"}],"source_inventory":{"bundle_path":"source_inventory.json","path":"source_inventory.json","producing_checkpoint":"e9ddb486ffb5ab7f9fc72baf6a81900f90eeb21f","schema_version":"2.0","sha256":"9009a8c8826c5a24f94aa350a130cd708dc0fb0d04c84d4592f219beb787693f"},"status":"FROZEN_FOR_SOURCE_ACQUISITION","trusted_inventory_checkpoint":"cd6e3154e852bdcda632cf054e9f921f615f21c4"}
